{
  "$schema": "https://json-schema.org/draft/2020-12/schema",
  "$id": "https://vonk-forge.invalid/schemas/workload-release-lock.schema.json",
  "title": "Vonk Forge immutable workload release lock",
  "type": "object",
  "additionalProperties": false,
  "required": [
    "schema_version",
    "family_id",
    "upstream_version",
    "upstream_identity",
    "components",
    "dependency_digests",
    "adapter",
    "adapter_abi",
    "compatibility",
    "validation",
    "provenance",
    "resolver"
  ],
  "properties": {
    "schema_version": {"const": 1},
    "family_id": {"$ref": "#/$defs/identifier"},
    "upstream_version": {"type": "string", "minLength": 1, "maxLength": 128},
    "upstream_identity": {"$ref": "#/$defs/upstream_identity"},
    "components": {
      "type": "array",
      "maxItems": 255,
      "items": {"$ref": "#/$defs/component"}
    },
    "dependency_digests": {
      "type": "array",
      "maxItems": 256,
      "uniqueItems": true,
      "items": {"$ref": "#/$defs/sha256"}
    },
    "adapter": {"$ref": "#/$defs/component"},
    "adapter_abi": {"type": "integer", "minimum": 1, "maximum": 255},
    "compatibility": {"$ref": "#/$defs/compatibility"},
    "validation": {
      "type": "array",
      "maxItems": 64,
      "items": {"$ref": "#/$defs/validation"}
    },
    "provenance": {
      "type": "array",
      "maxItems": 64,
      "items": {"$ref": "#/$defs/evidence"}
    },
    "resolver": {"$ref": "#/$defs/resolver"},
    "resource_envelope": {"$ref": "#/$defs/resource_envelope"}
  },
  "$defs": {
    "identifier": {
      "type": "string",
      "pattern": "^[a-z0-9](?:[a-z0-9._-]{0,126}[a-z0-9])?$"
    },
    "sha256": {"type": "string", "pattern": "^[0-9a-f]{64}$"},
    "content_digest": {"type": "string", "pattern": "^sha256:[0-9a-f]{64}$"},
    "relative_path": {
      "type": "string",
      "minLength": 1,
      "maxLength": 256,
      "pattern": "^(?!/)(?!.*(?:^|/)\\.?(?:/|$))(?!.*(?:^|/)\\.\\.(?:/|$))[^\\\\]+$"
    },
    "platform": {
      "type": "string",
      "pattern": "^[a-z0-9][a-z0-9._-]*/[a-z0-9][a-z0-9._-]*$"
    },
    "source": {
      "oneOf": [
        {
          "type": "object",
          "additionalProperties": false,
          "required": ["provider", "url"],
          "properties": {
            "provider": {"const": "https"},
            "url": {"type": "string", "pattern": "^https://[^?#]+$", "maxLength": 2048}
          }
        },
        {
          "type": "object",
          "additionalProperties": false,
          "required": ["provider", "reference"],
          "properties": {
            "provider": {"const": "oci"},
            "reference": {"type": "string", "pattern": "^[a-z0-9][a-z0-9._:/-]{0,510}@sha256:[0-9a-f]{64}$"}
          }
        },
        {
          "type": "object",
          "additionalProperties": false,
          "required": ["provider", "repository", "commit"],
          "properties": {
            "provider": {"const": "git"},
            "repository": {"type": "string", "pattern": "^https://[^?#]+$", "maxLength": 2048},
            "commit": {"type": "string", "pattern": "^(?:[0-9a-f]{40}|[0-9a-f]{64})$"}
          }
        },
        {
          "type": "object",
          "additionalProperties": false,
          "required": ["provider", "repository", "revision"],
          "properties": {
            "provider": {"const": "huggingface"},
            "repository": {"type": "string", "pattern": "^[A-Za-z0-9][A-Za-z0-9._-]{0,95}/[A-Za-z0-9][A-Za-z0-9._-]{0,95}$"},
            "revision": {"type": "string", "pattern": "^(?:[0-9a-f]{40}|[0-9a-f]{64})$"}
          }
        },
        {
          "type": "object",
          "additionalProperties": false,
          "required": ["provider", "url", "digest"],
          "properties": {
            "provider": {"enum": ["python-index", "signed-http-index"]},
            "url": {"type": "string", "pattern": "^https://[^?#]+$", "maxLength": 2048},
            "digest": {"$ref": "#/$defs/content_digest"}
          }
        }
      ]
    },
    "evidence": {
      "type": "object",
      "additionalProperties": false,
      "required": ["kind", "digest"],
      "properties": {
        "kind": {"$ref": "#/$defs/identifier"},
        "digest": {"$ref": "#/$defs/content_digest"}
      }
    },
    "materialization": {
      "oneOf": [
        {
          "type": "object",
          "additionalProperties": false,
          "required": ["method"],
          "properties": {
            "method": {
              "enum": ["file", "snapshot", "archive", "oci-content", "configuration", "native-archive", "wheel", "pylock-environment", "executable"]
            }
          }
        },
        {
          "$ref": "#/$defs/oci_bundle_materialization"
        }
      ]
    },
    "oci_bundle_materialization": {
      "type": "object",
      "additionalProperties": false,
      "required": ["method", "schema_version", "component", "manifest_digest", "config_digest", "rootfs_digest", "architecture", "runtime", "rootfs", "entrypoint"],
      "properties": {
        "method": {"const": "oci-bundle"},
        "schema_version": {"const": 1},
        "component": {"$ref": "#/$defs/identifier"},
        "manifest_digest": {"$ref": "#/$defs/content_digest"},
        "config_digest": {"$ref": "#/$defs/content_digest"},
        "rootfs_digest": {"$ref": "#/$defs/content_digest"},
        "architecture": {"enum": ["linux-arm64", "linux-x86_64"]},
        "runtime": {"const": "runc"},
        "rootfs": {"$ref": "#/$defs/relative_path"},
        "entrypoint": {"$ref": "#/$defs/relative_path"}
      }
    },
    "component": {
      "type": "object",
      "additionalProperties": false,
      "required": ["name", "kind", "media_type", "sources", "digest", "size", "unpacked_size", "platforms", "materialization", "evidence"],
      "properties": {
        "name": {"$ref": "#/$defs/identifier"},
        "kind": {"$ref": "#/$defs/identifier"},
        "media_type": {"type": "string", "pattern": "^[a-z0-9][a-z0-9!#$&^_.+-]*/[a-z0-9][a-z0-9!#$&^_.+-]*$"},
        "sources": {"type": "array", "minItems": 1, "maxItems": 8, "items": {"$ref": "#/$defs/source"}},
        "digest": {"$ref": "#/$defs/content_digest"},
        "size": {"type": "integer", "minimum": 1, "maximum": 9223372036854775807},
        "unpacked_size": {"type": ["integer", "null"], "minimum": 1, "maximum": 9223372036854775807},
        "platforms": {"type": "array", "minItems": 1, "maxItems": 16, "uniqueItems": true, "items": {"$ref": "#/$defs/platform"}},
        "materialization": {"$ref": "#/$defs/materialization"},
        "evidence": {"type": "array", "maxItems": 16, "items": {"$ref": "#/$defs/evidence"}}
      }
    },
    "upstream_identity": {
      "oneOf": [
        {
          "type": "object",
          "additionalProperties": false,
          "required": ["provider", "repository", "commit"],
          "properties": {
            "provider": {"const": "git"},
            "repository": {"type": "string", "pattern": "^https://[^?#]+$", "maxLength": 2048},
            "commit": {"type": "string", "pattern": "^(?:[0-9a-f]{40}|[0-9a-f]{64})$"}
          }
        },
        {
          "type": "object",
          "additionalProperties": false,
          "required": ["provider", "repository", "revision"],
          "properties": {
            "provider": {"const": "huggingface"},
            "repository": {"type": "string", "pattern": "^[A-Za-z0-9][A-Za-z0-9._-]{0,95}/[A-Za-z0-9][A-Za-z0-9._-]{0,95}$"},
            "revision": {"type": "string", "pattern": "^(?:[0-9a-f]{40}|[0-9a-f]{64})$"}
          }
        },
        {
          "type": "object",
          "additionalProperties": false,
          "required": ["provider", "reference"],
          "properties": {
            "provider": {"const": "oci"},
            "reference": {"type": "string", "pattern": "^[a-z0-9][a-z0-9._:/-]{0,510}@sha256:[0-9a-f]{64}$"}
          }
        },
        {
          "type": "object",
          "additionalProperties": false,
          "required": ["provider", "project", "version", "digest"],
          "properties": {
            "provider": {"const": "python-index"},
            "project": {"$ref": "#/$defs/identifier"},
            "version": {"type": "string", "minLength": 1, "maxLength": 128},
            "digest": {"$ref": "#/$defs/content_digest"}
          }
        },
        {
          "type": "object",
          "additionalProperties": false,
          "required": ["provider", "url", "digest"],
          "properties": {
            "provider": {"const": "signed-http-index"},
            "url": {"type": "string", "pattern": "^https://[^?#]+$", "maxLength": 2048},
            "digest": {"$ref": "#/$defs/content_digest"}
          }
        }
      ]
    },
    "compatibility": {
      "type": "object",
      "additionalProperties": false,
      "required": ["architectures", "operating_systems", "required_capabilities", "minimum_storage_bytes"],
      "properties": {
        "architectures": {"type": "array", "minItems": 1, "maxItems": 32, "uniqueItems": true, "items": {"$ref": "#/$defs/identifier"}},
        "operating_systems": {"type": "array", "minItems": 1, "maxItems": 32, "uniqueItems": true, "items": {"$ref": "#/$defs/identifier"}},
        "required_capabilities": {"type": "array", "maxItems": 32, "uniqueItems": true, "items": {"$ref": "#/$defs/identifier"}},
        "minimum_storage_bytes": {"type": "integer", "minimum": 1, "maximum": 9223372036854775807},
        "minimum_memory_bytes": {"type": "integer", "minimum": 1, "maximum": 9223372036854775807},
        "minimum_driver": {"type": "string", "minLength": 1, "maxLength": 64},
        "minimum_cuda": {"type": "string", "minLength": 1, "maxLength": 64},
        "backends": {"type": "array", "minItems": 1, "maxItems": 32, "uniqueItems": true, "items": {"enum": ["oci", "python-venv", "native"]}},
        "python_runtime": {"$ref": "#/$defs/python_runtime"}
      }
    },
    "python_runtime": {
      "type": "object",
      "additionalProperties": false,
      "required": ["environment_component", "environment_digest", "environment_tree_digest", "interpreter_component", "interpreter_component_digest", "interpreter_entrypoint", "interpreter_digest"],
      "properties": {
        "environment_component": {"$ref": "#/$defs/identifier"},
        "environment_digest": {"$ref": "#/$defs/content_digest"},
        "environment_tree_digest": {"$ref": "#/$defs/content_digest"},
        "interpreter_component": {"$ref": "#/$defs/identifier"},
        "interpreter_component_digest": {"$ref": "#/$defs/content_digest"},
        "interpreter_entrypoint": {"type": "string", "minLength": 1, "maxLength": 256, "pattern": "^(?!/)(?!.*(?:^|/)\\.?(?:/|$))(?!.*(?:^|/)\\.\\.(?:/|$))[^\\\\]+$"},
        "interpreter_digest": {"$ref": "#/$defs/content_digest"}
      }
    },
    "validation": {
      "type": "object",
      "additionalProperties": false,
      "required": ["kind"],
      "properties": {
        "kind": {"$ref": "#/$defs/identifier"},
        "component": {"$ref": "#/$defs/identifier"},
        "digest": {"$ref": "#/$defs/content_digest"},
        "required": {"type": "boolean"}
      }
    },
    "resolver": {
      "type": "object",
      "additionalProperties": false,
      "required": ["name", "version"],
      "properties": {
        "name": {"$ref": "#/$defs/identifier"},
        "version": {"type": "integer", "minimum": 1, "maximum": 2147483647}
      }
    },
    "resource_values": {
      "type": "object",
      "additionalProperties": false,
      "required": ["download_bytes", "installed_bytes", "transient_bytes", "output_bytes", "host_memory_bytes", "resident_memory_bytes", "auxiliary_memory_bytes", "activation_memory_bytes", "workspace_memory_bytes", "gpu_memory_bytes", "gpu_count", "cpu_millicores", "kv_cache_base_bytes", "kv_cache_per_token_bytes"],
      "properties": {
        "download_bytes": {"type": "integer", "minimum": 0, "maximum": 9223372036854775807},
        "installed_bytes": {"type": "integer", "minimum": 0, "maximum": 9223372036854775807},
        "transient_bytes": {"type": "integer", "minimum": 0, "maximum": 9223372036854775807},
        "output_bytes": {"type": "integer", "minimum": 0, "maximum": 9223372036854775807},
        "host_memory_bytes": {"type": "integer", "minimum": 0, "maximum": 9223372036854775807},
        "resident_memory_bytes": {"type": "integer", "minimum": 0, "maximum": 9223372036854775807},
        "auxiliary_memory_bytes": {"type": "integer", "minimum": 0, "maximum": 9223372036854775807},
        "activation_memory_bytes": {"type": "integer", "minimum": 0, "maximum": 9223372036854775807},
        "workspace_memory_bytes": {"type": "integer", "minimum": 0, "maximum": 9223372036854775807},
        "gpu_memory_bytes": {"type": "integer", "minimum": 0, "maximum": 9223372036854775807},
        "gpu_count": {"type": "integer", "minimum": 0, "maximum": 65535},
        "cpu_millicores": {"type": "integer", "minimum": 0, "maximum": 1000000},
        "kv_cache_base_bytes": {"type": "integer", "minimum": 0, "maximum": 9223372036854775807},
        "kv_cache_per_token_bytes": {"type": "integer", "minimum": 0, "maximum": 9223372036854775807}
      }
    },
    "resource_envelope": {
      "type": "object",
      "additionalProperties": false,
      "required": ["schema_version", "per_node", "aggregate", "required_nodes", "topology", "world_size", "ranks", "fabric", "measurement", "evidence"],
      "properties": {
        "schema_version": {"const": 1},
        "per_node": {"$ref": "#/$defs/resource_values"},
        "aggregate": {"$ref": "#/$defs/resource_values"},
        "required_nodes": {"type": "integer", "minimum": 1, "maximum": 512},
        "topology": {"enum": ["single", "replicated", "gang"]},
        "world_size": {"type": "integer", "minimum": 1, "maximum": 512},
        "ranks": {
          "type": "array",
          "minItems": 1,
          "maxItems": 512,
          "items": {
            "type": "object",
            "additionalProperties": false,
            "required": ["rank", "role"],
            "properties": {
              "rank": {"type": "integer", "minimum": 0, "maximum": 511},
              "role": {"$ref": "#/$defs/identifier"}
            }
          }
        },
        "fabric": {
          "type": "object",
          "additionalProperties": false,
          "required": ["kind", "min_bandwidth_mbps"],
          "properties": {
            "kind": {"$ref": "#/$defs/identifier"},
            "min_bandwidth_mbps": {"type": "integer", "minimum": 0, "maximum": 1000000000}
          }
        },
        "measurement": {"enum": ["declared", "measured"]},
        "evidence": {"type": "array", "minItems": 1, "maxItems": 16, "items": {"$ref": "#/$defs/evidence"}}
      }
    }
  }
}
